{
  "$schema": "https://json-schema.org/draft/2020-12/schema",
  "type": "object",
  "properties": {
    "schemaVersion": { "type": "number", "const": 1 },
    "id": {
      "type": "string",
      "pattern": "^job_[0-9a-f]{8}-[0-9a-f]{4}-[1-8][0-9a-f]{3}-[89ab][0-9a-f]{3}-[0-9a-f]{12}$"
    },
    "projectId": {
      "type": "string",
      "pattern": "^project_[0-9a-f]{8}-[0-9a-f]{4}-[1-8][0-9a-f]{3}-[89ab][0-9a-f]{3}-[0-9a-f]{12}$"
    },
    "issueId": {
      "type": "string",
      "pattern": "^issue_[0-9a-f]{8}-[0-9a-f]{4}-[1-8][0-9a-f]{3}-[89ab][0-9a-f]{3}-[0-9a-f]{12}$"
    },
    "createdAt": {
      "type": "string",
      "pattern": "^\\d{4}-\\d{2}-\\d{2}T\\d{2}:\\d{2}:\\d{2}\\.\\d{3}Z$"
    },
    "startedAt": {
      "type": "string",
      "pattern": "^\\d{4}-\\d{2}-\\d{2}T\\d{2}:\\d{2}:\\d{2}\\.\\d{3}Z$"
    },
    "watchdogExtensionGranted": { "type": "boolean" },
    "attempts": {
      "type": "object",
      "properties": {
        "processRecoveries": { "type": "integer", "minimum": 0, "maximum": 1 },
        "ciFixRounds": { "type": "integer", "minimum": 0, "maximum": 2 },
        "reviewerFixRounds": { "type": "integer", "minimum": 0, "maximum": 2 },
        "reviewRuns": { "type": "integer", "minimum": 0, "maximum": 3 }
      },
      "required": ["processRecoveries", "ciFixRounds", "reviewerFixRounds", "reviewRuns"],
      "additionalProperties": false
    }
  },
  "required": [
    "schemaVersion",
    "id",
    "projectId",
    "issueId",
    "createdAt",
    "watchdogExtensionGranted",
    "attempts"
  ],
  "additionalProperties": false,
  "description": "Job structure. Cross-field chronology is enforced by the Domain runtime."
}
